{
  "$schema": "./rules.schema.json",
  "schema_version": "0.2.0",
  "game": "Carta Arcanum",
  "rules_version": "2.1.4",
  "metadata": {
    "maintained_by": "manual",
    "notes": "Manual source dataset. SQL records are imported from this file and should not be edited directly. Core settlement, basic building, and advanced building tables have been seeded from the 2.1.4 PDF for review."
  },
  "currencies": [
    { "key": "gold_bar", "name": "Gold Bar", "copper_value": 972 },
    { "key": "crown", "name": "Crown", "copper_value": 324 },
    { "key": "bit", "name": "Bit", "copper_value": 54 },
    { "key": "piece", "name": "Piece", "copper_value": 18 },
    { "key": "tower", "name": "Tower", "copper_value": 3 },
    { "key": "copper", "name": "Copper", "copper_value": 1 }
  ],
  "resources": [
    { "key": "wood", "name": "Wood", "category": "basic" },
    { "key": "stone", "name": "Stone", "category": "basic" },
    { "key": "metal", "name": "Metal", "category": "basic" },
    { "key": "crops", "name": "Crops", "category": "basic" },
    { "key": "livestock", "name": "Livestock", "category": "basic" },
    { "key": "furs", "name": "Furs", "category": "basic" },
    { "key": "rarities", "name": "Rarities", "category": "basic" },
    { "key": "piety", "name": "Piety", "category": "basic" },
    { "key": "fish", "name": "Fish", "category": "basic" },
    { "key": "arcana", "name": "Arcana", "category": "basic" },
    { "key": "gold", "name": "Gold", "category": "wildcard" }
  ],
  "units": [
    { "key": "citizen", "name": "Citizen", "category": "labor" },
    { "key": "peasant", "name": "Peasant", "category": "labor" },
    { "key": "lumberjack", "name": "Lumberjack", "category": "production" },
    { "key": "mason", "name": "Mason", "category": "production" },
    { "key": "miner", "name": "Miner", "category": "production" },
    { "key": "farrier", "name": "Farrier", "category": "production" },
    { "key": "pelter", "name": "Pelter", "category": "production" },
    { "key": "mercator", "name": "Mercator", "category": "production" },
    { "key": "fidelis", "name": "Fidelis", "category": "religious" },
    { "key": "arcanist", "name": "Arcanist", "category": "magic" },
    { "key": "carpenter", "name": "Carpenter", "category": "production_specialist" },
    { "key": "master_mason", "name": "Master Mason", "category": "production_specialist" },
    { "key": "blacksmith", "name": "Blacksmith", "category": "production_specialist" },
    { "key": "reeve", "name": "Reeve", "category": "support" },
    { "key": "master_butcher", "name": "Master Butcher", "category": "production_specialist" },
    { "key": "master_tanner", "name": "Master Tanner", "category": "production_specialist" },
    { "key": "auctor", "name": "Auctor", "category": "arts" },
    { "key": "pontifex", "name": "Pontifex", "category": "religious" },
    { "key": "artifex", "name": "Artifex", "category": "magic" },
    { "key": "victual", "name": "Victual", "category": "special" },
    { "key": "weaponworks", "name": "Weaponswork", "category": "special" },
    { "key": "armor", "name": "Armor", "category": "special" },
    { "key": "scholar", "name": "Scholar", "category": "scholarly" },
    { "key": "master_merchant", "name": "Master Merchant", "category": "commerce" },
    { "key": "ignifer", "name": "Ignifer", "category": "exploration" },
    { "key": "innkeeper", "name": "Innkeeper", "category": "support" },
    { "key": "archer", "name": "Archer", "category": "military", "attack": 3, "defense": 1 },
    { "key": "herberist", "name": "Herberist", "category": "alchemical" },
    { "key": "malefactor", "name": "Malefactor", "category": "nefarious" },
    { "key": "spy", "name": "Spy", "category": "nefarious", "attack": 0, "defense": 0 },
    { "key": "pirate", "name": "Pirate", "category": "nefarious", "attack": 2, "defense": 2 },
    { "key": "mariner", "name": "Mariner", "category": "maritime", "attack": 1, "defense": 1 },
    { "key": "scout", "name": "Scout", "category": "military", "attack": 1, "defense": 1 },
    { "key": "bandit", "name": "Bandit", "category": "nefarious", "attack": 2, "defense": 2 },
    { "key": "fyrd", "name": "Fyrd", "category": "military", "attack": 1, "defense": 1 },
    { "key": "ward", "name": "Ward", "category": "military", "attack": 1, "defense": 2 },
    { "key": "man_at_arms", "name": "Man-At-Arms", "category": "military", "attack": 2, "defense": 2 },
    { "key": "knight", "name": "Knight", "category": "military", "attack": 5, "defense": 5 },
    { "key": "mercenary", "name": "Mercenary", "category": "military", "attack": 2, "defense": 2 },
    { "key": "thegn", "name": "Thegn", "category": "military", "attack": 3, "defense": 5 },
    { "key": "cataphract", "name": "Cataphract", "category": "military", "attack": 10, "defense": 10 },
    { "key": "paragon", "name": "Paragon", "category": "military", "attack": 25, "defense": 15 },
    { "key": "ship_master", "name": "Ship Master", "category": "maritime", "attack": 3, "defense": 3 },
    { "key": "burgess", "name": "Burgess", "category": "political" },
    { "key": "tinkerer", "name": "Tinkerer", "category": "support" }
  ],
  "settlement_tiers": [
    {
      "key": "claimed_land",
      "name": "Claimed Land",
      "min_buildings": 0,
      "max_buildings": 0,
      "upgrade_cost": [],
      "upkeep": [],
      "prerequisites": []
    },
    {
      "key": "homestead",
      "name": "Homestead",
      "min_buildings": 1,
      "max_buildings": 6,
      "upgrade_cost": [
        { "item_type": "resource", "item_key": "wood", "amount": 3 },
        { "item_type": "resource", "item_key": "furs", "amount": 3 },
        { "item_type": "resource", "item_key": "livestock", "amount": 3 },
        { "item_type": "unit", "item_key": "peasant", "amount": 4 },
        { "item_type": "currency", "item_key": "bit", "amount": 1 }
      ],
      "upkeep": [
        { "item_type": "unit", "item_key": "peasant", "amount": 2 },
        { "item_type": "resource", "item_key": "crops", "amount": 2 },
        { "item_type": "currency", "item_key": "piece", "amount": 1 }
      ],
      "prerequisites": ["claimed_land"]
    },
    {
      "key": "shire",
      "name": "Shire",
      "min_buildings": 7,
      "max_buildings": 12,
      "upgrade_cost": [
        { "item_type": "resource", "item_key": "wood", "amount": 12 },
        { "item_type": "resource", "item_key": "stone", "amount": 6 },
        { "item_type": "unit", "item_key": "peasant", "amount": 12 },
        { "item_type": "currency", "item_key": "crown", "amount": 1 }
      ],
      "upkeep": [
        { "item_type": "unit", "item_key": "peasant", "amount": 5 },
        { "item_type": "resource", "item_key": "crops", "amount": 5 },
        { "item_type": "resource", "item_key": "livestock", "amount": 2 },
        { "item_type": "currency", "item_key": "bit", "amount": 1 }
      ],
      "prerequisites": [
        "homestead",
        "all_6_surrounding_hexes_settled_and_homestead"
      ]
    },
    {
      "key": "village",
      "name": "Village",
      "min_buildings": 13,
      "max_buildings": 30,
      "upgrade_cost": [
        { "item_type": "resource", "item_key": "wood", "amount": 12 },
        { "item_type": "resource", "item_key": "stone", "amount": 24 },
        { "item_type": "unit", "item_key": "peasant", "amount": 18 },
        { "item_type": "currency", "item_key": "crown", "amount": 2 }
      ],
      "upkeep": [
        { "item_type": "unit", "item_key": "peasant", "amount": 9 },
        { "item_type": "resource", "item_key": "crops", "amount": 9 },
        { "item_type": "resource", "item_key": "livestock", "amount": 12 },
        { "item_type": "currency", "item_key": "bit", "amount": 3 }
      ],
      "prerequisites": [
        "shire",
        "all_6_surrounding_hexes_shires",
        "12_hexes_beyond_at_least_homesteads"
      ]
    },
    {
      "key": "city",
      "name": "City",
      "min_buildings": 31,
      "max_buildings": 80,
      "upgrade_cost": [
        { "item_type": "resource", "item_key": "wood", "amount": 24 },
        { "item_type": "resource", "item_key": "stone", "amount": 24 },
        { "item_type": "resource", "item_key": "metal", "amount": 12 },
        { "item_type": "unit", "item_key": "peasant", "amount": 24 },
        { "item_type": "currency", "item_key": "gold_bar", "amount": 1 }
      ],
      "upkeep": [
        { "item_type": "unit", "item_key": "peasant", "amount": 18 },
        { "item_type": "resource", "item_key": "crops", "amount": 18 },
        { "item_type": "resource", "item_key": "livestock", "amount": 24 },
        { "item_type": "currency", "item_key": "crown", "amount": 1 }
      ],
      "prerequisites": [
        "village",
        "all_6_surrounding_hexes_villages",
        "12_hexes_beyond_at_least_shires",
        "18_hexes_beyond_those_at_least_homesteads"
      ]
    }
  ],
  "building_definitions": [
    {
      "key": "orchard",
      "name": "Orchard",
      "category": "basic",
      "map_visible": false,
      "settlement_requirement": "homestead",
      "requirements": [],
      "effects": ["Basic building paired with Lumber Mill. Produces Wood."],
      "build_cost": [
        { "item_type": "resource", "item_key": "crops", "amount": 2 },
        { "item_type": "resource", "item_key": "wood", "amount": 3 },
        { "item_type": "unit", "item_key": "peasant", "amount": 1 },
        { "item_type": "currency", "item_key": "tower", "amount": 2 }
      ],
      "upkeep": [
        { "item_type": "resource", "item_key": "wood", "amount": 1 },
        { "item_type": "currency", "item_key": "tower", "amount": 1 }
      ]
    },
    {
      "key": "quarry",
      "name": "Quarry",
      "category": "basic",
      "map_visible": false,
      "settlement_requirement": "homestead",
      "requirements": [],
      "effects": ["Basic building paired with Masonry. Produces Stone."],
      "build_cost": [